{
  "schema_version": "1",
  "installation_id": 1,
  "repository_id": 1,
  "pr_number": 42,
  "event_id": "review-comment-102",
  "delivery_id": "example-delivery-1",
  "event_kind": "pull_request_review_comment",
  "event_action": "created",
  "actor_login": "example-developer",
  "actor_type": "User",
  "created_at": "2026-10-29T09:00:00Z",
  "updated_at": null,
  "body": "@openreview review: does the new validation prevent the issue from the earlier thread?",
  "parent_event_id": "review-comment-99",
  "thread_id": "example-thread-7",
  "path": "src/validation.rs",
  "line": 25,
  "commit_sha": "0000000000000000000000000000000000000000",
  "head_sha_at_snapshot": "0000000000000000000000000000000000000000",
  "trust_level": "untrusted_user_content",
  "permalink": null,
  "context_truncated": false
}
